{
  "authority": "CAA (FAA)",
  "title_number": 14,
  "part": "CAR 3",
  "description": "Civil Air Regulations Part 3 \u2014 Airplane Airworthiness; Normal, Utility, and Acrobatic Categories (1949)",
  "amendments": [
    {
      "designator": "CAR3-0",
      "ordinal": 0,
      "effective_date": "1949-11-01"
    }
  ]
}
