{
  "authority": "FAA",
  "title_number": 14,
  "part": "23",
  "description": null,
  "amendments": [
    {
      "designator": "23-0",
      "ordinal": 0,
      "effective_date": "1965-01-02"
    },
    {
      "designator": "23-5",
      "ordinal": 5,
      "effective_date": "1967-04-06"
    },
    {
      "designator": "23-6",
      "ordinal": 6,
      "effective_date": "1967-01-08"
    },
    {
      "designator": "23-7",
      "ordinal": 7,
      "effective_date": "1969-09-14"
    },
    {
      "designator": "23-10",
      "ordinal": 10,
      "effective_date": "1971-03-13"
    },
    {
      "designator": "23-13",
      "ordinal": 13,
      "effective_date": "1972-10-23"
    },
    {
      "designator": "23-14",
      "ordinal": 14,
      "effective_date": "1973-12-20"
    },
    {
      "designator": "23-15",
      "ordinal": 15,
      "effective_date": "1974-10-31"
    },
    {
      "designator": "23-17",
      "ordinal": 17,
      "effective_date": "1977-01-02"
    },
    {
      "designator": "23-18",
      "ordinal": 18,
      "effective_date": "1977-02-05"
    },
    {
      "designator": "23-21",
      "ordinal": 21,
      "effective_date": "1978-01-03"
    },
    {
      "designator": "23-27",
      "ordinal": 27,
      "effective_date": "1980-11-18"
    },
    {
      "designator": "23-28",
      "ordinal": 28,
      "effective_date": "1982-04-28"
    },
    {
      "designator": "23-29",
      "ordinal": 29,
      "effective_date": "1984-03-26"
    },
    {
      "designator": "23-34",
      "ordinal": 34,
      "effective_date": "1987-02-17"
    },
    {
      "designator": "23-36",
      "ordinal": 36,
      "effective_date": "1988-09-14"
    },
    {
      "designator": "23-42",
      "ordinal": 42,
      "effective_date": "1991-04-02"
    },
    {
      "designator": "23-43",
      "ordinal": 43,
      "effective_date": "1993-10-05"
    },
    {
      "designator": "23-45",
      "ordinal": 45,
      "effective_date": "1993-07-09"
    },
    {
      "designator": "23-48",
      "ordinal": 48,
      "effective_date": "1996-11-03"
    },
    {
      "designator": "23-49",
      "ordinal": 49,
      "effective_date": "1996-11-03"
    },
    {
      "designator": "23-50",
      "ordinal": 50,
      "effective_date": "1996-11-03"
    },
    {
      "designator": "23-51",
      "ordinal": 51,
      "effective_date": "1996-11-03"
    },
    {
      "designator": "23-53",
      "ordinal": 53,
      "effective_date": "1998-04-30"
    },
    {
      "designator": "23-58",
      "ordinal": 58,
      "effective_date": "2008-07-04"
    },
    {
      "designator": "23-62",
      "ordinal": 62,
      "effective_date": "2012-01-31"
    }
  ]
}
